{
  "schemaVersion": 1,
  "id": "highlight-demo",
  "evidenceIDs": [
    "ev-1-0"
  ],
  "originalExcerpt": "Ein lokales Modell kann Anfragen ohne externen Modellanbieter verarbeiten.",
  "userNote": "Meine eigene Testnotiz.",
  "generatedSummary": "Synthetische Kurzfassung.",
  "tags": [
    "lokal"
  ],
  "revision": 1,
  "origin": "player",
  "timingStatus": "verified"
}
